<!ELEMENT listFilms (film)*>
<!ATTLIST film id CDATA "0">
<!ELEMENT film (brand,type,iso,iso_used?,color,format?,date?,pfactor?)>
<!ELEMENT brand (#PCDATA)>
<!ELEMENT type (#PCDATA)>
<!ELEMENT iso (#PCDATA)>
<!ELEMENT iso_used (#PCDATA)>
<!ELEMENT color (#PCDATA)>
<!ELEMENT format (#PCDATA)>
<!ELEMENT date (#PCDATA)>
<!ELEMENT pfactor (#PCDATA)>